title,link,description,pub_date,category,section,crawl_time
Hộ kinh doanh chuyển từ nộp thuế khoán sang kê khai: 7 lưu ý cần phải biết,http://vietstock.vn/2025/06/ho-kinh-doanh-chuyen-tu-nop-thue-khoan-sang-ke-khai-7-luu-y-can-phai-biet-4261-1318193.htm,"Dưới đây là hướng dẫn hộ kinh doanh chuyển đổi từ nộp thuế khoán sang phương pháp kê khai một cách đơn giản, chính xác từ Chi cục Thuế khu vực II.","Sun, 15 Jun 2025 17:55:00 +0700",Đầu tư – Kinh doanh nhỏ,Tài chính,2025-07-20 11:42:23
"Hộ kinh doanh đóng cửa né kiểm tra, hàng tồn kho không chứng từ, hóa đơn xử lý thế nào?",http://vietstock.vn/2025/06/ho-kinh-doanh-dong-cua-ne-kiem-tra-hang-ton-kho-khong-chung-tu-hoa-don-xu-ly-the-nao-4261-1318191.htm,"Giữa cao điểm chống hàng giả, hàng nhái, nhiều hộ kinh doanh, tiểu thương ở các chợ truyền thống, tuyến phố kinh doanh đóng cửa hàng loạt.","Sun, 15 Jun 2025 16:55:00 +0700",Đầu tư – Kinh doanh nhỏ,Tài chính,2025-07-20 11:42:23
"Góc nhìn tuần 14-18/07: Rộng cửa lên 1,500?",http://vietstock.vn/2025/07/goc-nhin-tuan-14-1807rong-cua-len-1500-145-1327576.htm,"VN-Index đang tiến gần vùng đỉnh lịch sử với đà tăng được hỗ trợ bởi dòng tiền mạnh và lực cầu chủ động. Nhiều công ty chứng khoán (CTCK) nhận định dư địa tăng vẫn còn, và nhà đầu tư có thể tận dụng nhịp rung lắc nếu xảy ra để gia tăng vị thế.","Sun, 13 Jul 2025 21:21:00 +0700",Ý kiến chuyên gia,Chứng khoán,2025-07-20 11:41:41
Thị trường chứng quyền tuần 14-18/07/2025: Các tín hiệu đang ủng hộ phe Long,http://vietstock.vn/2025/07/thi-truong-chung-quyen-tuan-14-18072025-cac-tin-hieu-dang-ung-ho-phe-long-1636-1327643.htm,"Kết thúc phiên giao dịch ngày 11/07/2025, toàn thị trường có 148 mã tăng, 48 mã giảm và 21 mã tham chiếu. Khối ngoại tiếp tục mua ròng với tổng mức mua ròng đạt 272,400 CW.","Sun, 13 Jul 2025 20:00:00 +0700",Chứng quyền,Chứng khoán,2025-07-20 11:41:40
Thu thuế VAT tự động với hàng nhập khẩu qua chuyển phát nhanh dưới 1 triệu đồng từ 1-8,http://vietstock.vn/2025/07/thu-thue-vat-tu-dong-voi-hang-nhap-khau-qua-chuyen-phat-nhanh-duoi-1-trieu-dong-tu-1-8-758-1327746.htm,"Theo cơ quan hải quan, từ 1-8, thu thuế VAT tự động với hàng nhập khẩu giá trị dưới 1 triệu đồng qua chuyển phát nhanh.","Sun, 13 Jul 2025 18:06:46 +0700",Thuế và Ngân sách,Tài chính,2025-07-20 11:42:07
Thu thuế VAT tự động với hàng nhập khẩu qua chuyển phát nhanh dưới 1 triệu đồng từ 1-8,http://vietstock.vn/2025/07/thu-thue-vat-tu-dong-voi-hang-nhap-khau-qua-chuyen-phat-nhanh-duoi-1-trieu-dong-tu-1-8-758-1327746.htm,"Theo cơ quan hải quan, từ 1-8, thu thuế VAT tự động với hàng nhập khẩu giá trị dưới 1 triệu đồng qua chuyển phát nhanh.","Sun, 13 Jul 2025 18:06:46 +0700",Đầu tư – Kinh doanh nhỏ,Tài chính,2025-07-20 11:42:23
Mua bán vàng từ 20 triệu đồng trong ngày phải chuyển khoản,http://vietstock.vn/2025/07/mua-ban-vang-tu-20-trieu-dong-trong-ngay-phai-chuyen-khoan-4261-1327742.htm,Ngân hàng Nhà nước Việt Nam đề xuất bổ sung nhiều quy định mới trong quản lý thị trường vàng.,"Sun, 13 Jul 2025 17:28:00 +0700",Vàng và kim loại quý,Hàng hóa,2025-07-20 11:42:00
Mua bán vàng từ 20 triệu đồng trong ngày phải chuyển khoản,http://vietstock.vn/2025/07/mua-ban-vang-tu-20-trieu-dong-trong-ngay-phai-chuyen-khoan-4261-1327742.htm,Ngân hàng Nhà nước Việt Nam đề xuất bổ sung nhiều quy định mới trong quản lý thị trường vàng.,"Sun, 13 Jul 2025 17:28:00 +0700",Đầu tư – Kinh doanh nhỏ,Tài chính,2025-07-20 11:42:23
"Chung cư Hà Nội tăng phi mã, nhà đầu tư 'ôm' tiền vào siêu đô thị TPHCM",http://vietstock.vn/2025/07/chung-cu-ha-noi-tang-phi-ma-nha-dau-tu-om-tien-vao-sieu-do-thi-tphcm-4220-1327743.htm,"Theo chuyên gia, giá bất động sản tại Hà Nội đã lên quá cao, trong khi TPHCM và đặc biệt là khu Đông Bắc mới chỉ dao động 40-50 triệu đồng/m2, mức giá được xem hợp lý hiện nay. Sự chênh lệch này khiến thanh khoản giữa các khu vực khác biệt rõ rệt.","Sun, 13 Jul 2025 15:02:00 +0700",Thị trường nhà đất,Bất động sản,2025-07-20 11:41:54
Tuần 14-18/07: Cổ tức cao nhất tới 110%,http://vietstock.vn/2025/07/tuan-14-1807-co-tuc-cao-nhat-toi-110-738-1327706.htm,"Trong tuần từ 14-18/07/2025, có 30 doanh nghiệp chốt quyền chia cổ tức bằng tiền. Tỷ lệ cao nhất lên tới 110% - tức cổ đông có thể nhận 11,000 đồng cho mỗi cổ phiếu sở hữu.","Sun, 13 Jul 2025 15:00:00 +0700",Cổ tức,Doanh nghiệp,2025-07-20 11:41:48
"Giá vàng hôm nay 13-7: Tăng mạnh, đồng loạt dự báo đi lên",http://vietstock.vn/2025/07/gia-vang-hom-nay-13-7-tang-manh-dong-loat-du-bao-di-len-759-1327741.htm,Cả giới phân tích lẫn chuyên gia đều đồng loạt dự báo giá vàng hôm nay sẽ tăng tiếp.,"Sun, 13 Jul 2025 14:45:00 +0700",Vàng và kim loại quý,Hàng hóa,2025-07-20 11:42:00
"Doanh nghiệp, ngân hàng nào sẽ được sản xuất vàng miếng?",http://vietstock.vn/2025/07/doanh-nghiep-ngan-hang-nao-se-duoc-san-xuat-vang-mieng-757-1327740.htm,Doanh nghiệp được xem xét cấp giấy phép sản xuất vàng miếng phải có vốn điều lệ từ 1.000 tỉ đồng trở lên; còn ngân hàng từ 50.000 tỉ đồng trở lên.,"Sun, 13 Jul 2025 14:21:00 +0700",Vàng và kim loại quý,Hàng hóa,2025-07-20 11:42:00
Bùng nổ quỹ ETF rủi ro cao (phần 2):  Quãng đường dài với nhiều biến động,http://vietstock.vn/2025/07/bung-no-quy-etf-rui-ro-cao-phan-2-quang-duong-dai-voi-nhieu-bien-dong-772-1327673.htm,"Hành trình phát triển của ETF đòn bẩy cổ phiếu đơn lẻ tại Mỹ thực sự là một quãng đường dài với nhiều biến động. Dù các sản phẩm này đã xuất hiện tại châu Âu từ năm 2017, phải đến năm 2022 chúng mới chính thức đặt chân lên thị trường Mỹ.","Sun, 13 Jul 2025 14:02:00 +0700",Tài chính quốc tế,Tài chính,2025-07-20 11:42:14
Cục Thuế nêu rõ cách ghi địa chỉ trên hóa đơn điện tử theo địa bàn hành chính 2 cấp,http://vietstock.vn/2025/07/cuc-thue-neu-ro-cach-ghi-dia-chi-tren-hoa-don-dien-tu-theo-dia-ban-hanh-chinh-2-cap-758-1327726.htm,"Địa chỉ của người nộp thuế theo địa bàn hành chính 2 cấp sẽ được đồng bộ cho tất cả các ứng dụng của ngành thuế. Theo đó, sau sáp nhập, địa chỉ ghi trên hóa đơn điện tử sẽ được ghi thế nào?","Sun, 13 Jul 2025 11:29:00 +0700",Thuế và Ngân sách,Tài chính,2025-07-20 11:42:07
Đề xuất giảm 50% tiền chuyển từ đất nông nghiệp sang đất ở,http://vietstock.vn/2025/07/de-xuat-giam-50-tien-chuyen-tu-dat-nong-nghiep-sang-dat-o-4266-1327728.htm,"Theo tờ trình dự thảo sửa đổi, bổ sung Nghị định 103/2024/NĐ-CP về tiền sử dụng đất, Bộ Tài chính đã điều chỉnh cách tính tiền sử dụng đất khi chuyển mục đích sử dụng đất vườn, ao trong cùng thửa đất có nhà ở.","Sun, 13 Jul 2025 11:22:22 +0700",Bảo hiểm và thuế nhà đất,Bất động sản,2025-07-20 11:41:58
"Giá tiêu lẹt đẹt, vì sao?",http://vietstock.vn/2025/07/gia-tieu-let-det-vi-sao-118-1327725.htm,"Giá tiêu từng được dự báo sẽ lên mức 180.000 - 200.000 đồng/kg nhưng hiện nay vẫn lẹt đẹt, vì sao?","Sun, 13 Jul 2025 10:33:00 +0700",Nông sản thực phẩm,Hàng hóa,2025-07-20 11:42:03
Phân quyền mạnh cho cấp xã: Cơ hội và thách thức trong cấp giấy chứng nhận quyền sử dụng đất,http://vietstock.vn/2025/07/phan-quyen-manh-cho-cap-xa-co-hoi-va-thach-thuc-trong-cap-giay-chung-nhan-quyen-su-dung-dat-4220-1326015.htm,"Ngày 12/06/2025, Chính phủ ban hành Nghị định 151/2025/NĐ-CP về phân định thẩm quyền của chính quyền địa phương hai cấp, có hiệu lực từ ngày 01/7/2025 mở rộng thẩm quyền của Ủy ban nhân dân (UBND) cấp xã. Theo đó có thể kể đến một số quy định mới về trong trình tự, thủ tục cấp giấy chứng nhận quyền sử dụng đất, quyền sở hữu nhà ở và tài sản khác gắn liền với đất (GCN QSDĐ), cụ thể như sau:","Sun, 13 Jul 2025 10:02:00 +0700",Thị trường nhà đất,Bất động sản,2025-07-20 11:41:54
Dự án gọi đầu tư 05-11/07/2025: 11 khu đô thị lớn vốn hơn 332.6 ngàn tỷ,http://vietstock.vn/2025/07/du-an-goi-dau-tu-05-11072025-11-khu-do-thi-lon-von-hon-3326-ngan-ty-4222-1327704.htm,"Tuần 05-11/07/2025, có 6 tỉnh, thành phố mời gọi đầu tư 16 dự án với tổng vốn đầu tư hơn 403.6 ngàn tỷ đồng. Trong đó, nổi bật nhất tại TPHCM với 7 dự án khu đô thị trên diện tích gần 1,007ha, tổng vốn đầu tư hơn 265.2 ngàn tỷ đồng (hơn 10 tỷ USD) và 1 dự án tại Quảng Ninh 51,555 tỷ đồng.","Sun, 13 Jul 2025 09:30:00 +0700",Dự án,Bất động sản,2025-07-20 11:41:57
Giao dịch quỹ đầu tư: Lực bán chiếm ưu thế,http://vietstock.vn/2025/07/giao-dich-quy-dau-tu-luc-ban-chiem-uu-the-3358-1327692.htm,"Trong tuần từ 07–11/07, hoạt động giao dịch của các quỹ đầu tư nghiêng về phía bán ra, trong bối cảnh thị trường nối dài chuỗi tăng điểm. Diễn biến tích cực của chỉ số thúc đẩy tâm lý chốt lời, buộc nhiều quỹ chủ động cơ cấu danh mục theo hướng thận trọng hơn.","Sun, 13 Jul 2025 08:30:00 +0700",ETF và các quỹ,Chứng khoán,2025-07-20 11:41:37
Phân tích kỹ thuật chứng khoán Việt Nam: Tuần 14-18/07/2025,http://vietstock.vn/2025/07/phan-tich-ky-thuat-chung-khoan-viet-nam-tuan-14-18072025-585-1327648.htm,Chiến lược đầu tư & Phân tích kỹ thuật chuyên sâu thị trường chứng khoán Việt Nam.,"Sun, 13 Jul 2025 07:30:00 +0700",Phân tích kỹ thuật,Phân tích,2025-07-20 11:42:33
Giá đồng hồ Rolex chạm đáy,http://vietstock.vn/2022/09/gia-dong-ho-rolex-cham-day-4263-1000577.htm,"Các thiết bị đã qua sử dụng từ Rolex, Patek Philippe tiếp tục giảm. Những dấu hiệu này cho thấy thị trường đang hạ nhiệt.","Sun, 11 Sep 2022 15:00:00 +0700",Chơi sang,Tài chính,2025-07-20 11:42:25
"Sau đại dịch, giới siêu giàu còn tốn tiền hơn vào du lịch",http://vietstock.vn/2021/10/sau-dai-dich-gioi-sieu-giau-con-ton-tien-hon-vao-du-lich-4263-899181.htm,"Nhu cầu du lịch của nhóm giàu nhất thế giới không chậm lại trong đại dịch, thậm chí tăng mạnh với những yêu cầu đặc biệt, tốn kém hơn.","Sun, 10 Oct 2021 21:00:00 +0700",Chơi sang,Tài chính,2025-07-20 11:42:25
Du lịch Campuchia sẽ trở thành đối thủ đáng gờm của Thái Lan?,http://vietstock.vn/2025/02/du-lich-campuchia-se-tro-thanh-doi-thu-dang-gom-cua-thai-lan-1326-1270287.htm,"Thời gian gần đây, du lịch Campuchia ngày càng trở nên hấp dẫn đối với du khách quốc tế. Theo nhận định của những người trong cuộc, ngành du lịch quốc gia Đông Nam Á này có thể sớm cạnh tranh với điểm du lịch nổi tiếng của khu vực là Thái Lan.","Sun, 09 Feb 2025 21:02:00 +0700",Vĩ mô,Đông Dương,2025-07-20 11:42:16
"Campuchia đặt mục tiêu nâng giá trị giao dịch chứng khoán lên 300,000 USD mỗi ngày",http://vietstock.vn/2025/02/campuchia-dat-muc-tieu-nang-gia-tri-giao-dich-chung-khoan-len-300000-usd-moi-ngay-1328-1270283.htm,"Một báo cáo được Sở Giao dịch Chứng khoán Campuchia (CSX) công bố gần đây đã nêu cụ thể những diễn biến chính của thị trường chứng khoán Vương quốc trong suốt năm 2024 đồng thời đề ra những mục tiêu chiến lược cho năm 2025. Theo đó, các mục tiêu cho năm nay bao gồm gia tăng đáng kể giá trị giao dịch hằng ngày, mở rộng tài khoản giao dịch mới và chào đón ít nhất 6 doanh nghiệp niêm yết (DNNY) mới.","Sun, 09 Feb 2025 12:52:51 +0700",Thị trường chứng khoán,Chứng khoán,2025-07-20 11:42:19
Bắt nhiều đối tượng lừa đảo chiếm đoạt 10.000 tỉ đồng,http://vietstock.vn/2025/06/bat-nhieu-doi-tuong-lua-dao-chiem-doat-10000-ti-dong-768-1316136.htm,"Cặp đôi đã thuê người viết phần mềm dự án đồng tiền ảo Matrix Chaine với giá 520 triệu đồng rồi lôi kéo nhà đầu tư tham gia, chiếm đoạt 10.000 tỉ đồng.","Sun, 08 Jun 2025 11:35:00 +0700",Tiền kỹ thuật số,Thế giới,2025-07-20 11:42:12
"Khi công ty bảo hiểm xe ""treo đầu dê...""",http://vietstock.vn/2025/06/khi-cong-ty-bao-hiem-xe-treo-dau-de-768-1316138.htm,Nhiều chủ xe thất vọng vì bảo hiểm mua tại đại lý chính hãng còn tệ hơn bên ngoài.,"Sun, 08 Jun 2025 10:30:00 +0700",Bảo hiểm,Tài chính,2025-07-20 11:42:06
Cục Thuế đề nghị đẩy nhanh triển khai hóa đơn điện tử từ máy tính tiền,http://vietstock.vn/2025/06/cuc-thue-de-nghi-day-nhanh-trien-khai-hoa-don-dien-tu-tu-may-tinh-tien-768-1316120.htm,"Cục Thuế đề nghị các đơn vị cung cấp giải pháp hóa đơn điện tử chủ động phối hợp, hỗ trợ kỹ thuật và đồng hành chặt chẽ trong việc triển khai hóa đơn điện tử khởi tạo từ máy tính tiền, nhất là với hộ kinh doanh bán lẻ.","Sun, 08 Jun 2025 10:02:00 +0700",Đầu tư – Kinh doanh nhỏ,Tài chính,2025-07-20 11:42:23
"Chủ tịch UBND TP.HCM cùng 4,000 người đi bộ vì người dân có hoàn cảnh khó khăn",http://vietstock.vn/2024/12/chu-tich-ubnd-tphcm-cung-4000-nguoi-di-bo-vi-nguoi-dan-co-hoan-canh-kho-khan-735-1251011.htm,"Sáng 08/12, Quận ủy, UBND, Ủy ban MTTQ Việt Nam quận Phú Nhuận tổ chức Cuộc đi bộ “Đồng hành chăm lo cho người dân có hoàn cảnh khó khăn” vận động Quỹ xã hội quận Phú Nhuận năm 2024.","Sun, 08 Dec 2024 15:22:36 +0700",Vì cộng đồng,Tài chính,2025-07-20 11:42:29
Thị trường chứng quyền tuần 07-11/07/2025: Triển vọng ngắn hạn đang được cải thiện,http://vietstock.vn/2025/07/thi-truong-chung-quyen-tuan-07-11072025-trien-vong-ngan-han-dang-duoc-cai-thien-1636-1325390.htm,"Kết thúc phiên giao dịch ngày 04/07/2025, toàn thị trường có 102 mã tăng, 68 mã giảm và 30 mã tham chiếu. Khối ngoại tiếp tục mua ròng với tổng mức mua ròng đạt 2.92 triệu CW.","Sun, 06 Jul 2025 20:00:00 +0700",Chứng quyền,Chứng khoán,2025-07-20 11:41:40
Vietjet có Giám đốc điều hành mới,http://vietstock.vn/2025/07/vietjet-co-giam-doc-dieu-hanh-moi-214-1325436.htm,CTCP Hàng không Vietjet (HoSE: VJC) vừa công bố bổ nhiệm ông Nguyễn Thanh Sơn làm Giám đốc điều hành của công ty.,"Sun, 06 Jul 2025 14:17:23 +0700",Nhân vật,Doanh nghiệp,2025-07-20 11:41:52
"Hóa đơn tiền điện tháng 6 tăng cao, EVN yêu cầu rà soát",http://vietstock.vn/2025/07/hoa-don-tien-dien-thang-6-tang-cao-evn-yeu-cau-ra-soat-4265-1325435.htm,EVN yêu cầu rà soát từng trường hợp phản ánh về hóa đơn tiền điện tháng 6-2025 tăng cao.,"Sun, 06 Jul 2025 14:02:00 +0700",Tiêu dùng và lối sống,Tài chính,2025-07-20 11:42:28
Nguồn cung ô tô quá dư thừa,http://vietstock.vn/2025/07/nguon-cung-o-to-qua-du-thua-4264-1325432.htm,Thị trường ô tô Việt Nam đang chứng kiến tình trạng dư thừa nguồn cung nghiêm trọng.,"Sun, 06 Jul 2025 12:14:00 +0700",Xe - Công nghệ,Tài chính,2025-07-20 11:42:27
Đề xuất chia hộ kinh doanh để quản lý thuế,http://vietstock.vn/2025/07/de-xuat-chia-ho-kinh-doanh-de-quan-ly-thue-758-1325430.htm,Việc chuyển từ hình thức thuế khoán sang tự kê khai thuế nhằm hiện đại hóa công tác quản lý thuế và nâng cao tính minh bạch trong kinh doanh.,"Sun, 06 Jul 2025 10:38:00 +0700",Thuế và Ngân sách,Tài chính,2025-07-20 11:42:07
"Quỹ đầu tư mua, bán gì tuần qua?",http://vietstock.vn/2025/07/quy-dau-tu-mua-ban-gi-tuan-qua-3358-1325427.htm,"Theo thông tin công bố, quỹ đầu tư vẫn chưa công khai kết quả giao dịch cổ phiếu trong tuần từ 30/06 - 04/07.","Sun, 06 Jul 2025 08:30:00 +0700",ETF và các quỹ,Chứng khoán,2025-07-20 11:41:37
Phân tích kỹ thuật chứng khoán Việt Nam: Tuần 07-11/07/2025,http://vietstock.vn/2025/07/phan-tich-ky-thuat-chung-khoan-viet-nam-tuan-07-11072025-585-1325387.htm,Chiến lược đầu tư & Phân tích kỹ thuật chuyên sâu thị trường chứng khoán Việt Nam.,"Sun, 06 Jul 2025 07:30:00 +0700",Phân tích kỹ thuật,Phân tích,2025-07-20 11:42:33
Những câu nói ấn tượng của Warren Buffett tại cuộc họp Berkshire Hathaway,http://vietstock.vn/2025/05/nhung-cau-noi-an-tuong-cua-warren-buffett-tai-cuoc-hop-berkshire-hathaway-3355-1304434.htm,"Trong cuộc họp cổ đông Berkshire Hathaway lần thứ 60 diễn ra vào ngày 03/05 vừa qua, Warren Buffett thông báo bàn giao vị trí CEO cho Phó Chủ tịch Greg Abel. Điểm nhấn của sự kiện này không chỉ là thông báo gây sốc về việc rút lui, mà còn là những chia sẻ sâu sắc của ""nhà hiền triết xứ Omaha"" về nhiều vấn đề quan trọng từ thương mại quốc tế đến tương lai nền kinh tế Mỹ.","Sun, 04 May 2025 13:54:44 +0700",Câu chuyện đầu tư,Chứng khoán,2025-07-20 11:41:43
Xóa thuế khoán: Hộ kinh doanh bước vào giai đoạn phát triển mới,http://vietstock.vn/2025/05/xoa-thue-khoan-ho-kinh-doanh-buoc-vao-giai-doan-phat-trien-moi-758-1313947.htm,"Từ năm 2026, hộ kinh doanh sẽ chính thức chấm dứt cơ chế thuế khoán, thay bằng tự kê khai, nộp thuế theo doanh thu thực tế. Cải cách này không chỉ tăng minh bạch mà còn mở ra cơ hội nâng tầm hộ kinh doanh trở thành doanh nghiệp (DN).","Sun, 01 Jun 2025 15:30:00 +0700",Đầu tư – Kinh doanh nhỏ,Tài chính,2025-07-20 11:42:23
Hộ kinh doanh phải kết nối máy tính tiền với hoá đơn điện tử từ hôm nay 1-6,http://vietstock.vn/2025/06/ho-kinh-doanh-phai-ket-noi-may-tinh-tien-voi-hoa-don-dien-tu-tu-hom-nay-1-6-768-1313936.htm,"Từ ngày mai (1/6), hộ kinh doanh có doanh thu từ 1 tỷ đồng/năm trở lên phải sử dụng hóa đơn điện tử khởi tạo từ máy tính tiền, nếu không sẽ bị phạt tiền.","Sun, 01 Jun 2025 10:46:00 +0700",Đầu tư – Kinh doanh nhỏ,Tài chính,2025-07-20 11:42:23
"Giá điện riêng với trạm, trụ sạc xe điện, cao nhất gần 4.300 đồng/kWh",http://vietstock.vn/2025/05/gia-dien-rieng-voi-tram-tru-sac-xe-dien-cao-nhat-gan-4300-dongkwh-768-1313935.htm,"Trạm, trụ sạc cho xe điện sẽ được áp biểu giá bán lẻ điện riêng theo cấp điện áp, trong giờ cao điểm có thể phải trả tới 4.298 đồng/kWh.","Sun, 01 Jun 2025 08:45:00 +0700",Đầu tư – Kinh doanh nhỏ,Tài chính,2025-07-20 11:42:23
Bảo hiểm tín dụng là gì?,http://vietstock.vn/2025/05/bao-hiem-tin-dung-la-gi-3113-1312824.htm,"Khi vay ngân hàng, bạn có thể được đề nghị tham gia bảo hiểm tín dụng (bảo hiểm khoản vay) để giảm rủi ro cho cả hai bên. Vậy bảo hiểm tín dụng có lợi ích gì cho người vay và bên cho vay?","Sat, 31 May 2025 21:02:00 +0700",Bảo hiểm,Tài chính,2025-07-20 11:42:06
Vàng thế giới giảm sau báo cáo lạm phát của Mỹ,http://vietstock.vn/2024/08/vang-the-gioi-giam-sau-bao-cao-lam-phat-cua-my-759-1225412.htm,"Giá vàng giảm vào ngày thứ Sáu (30/08), do đồng USD và lợi suất trái phiếu Mỹ tăng sau khi dữ liệu lạm phát Mỹ khớp với kỳ vọng, tuy nhiên, vàng vẫn ghi nhận mức tăng trong tháng nhờ dự báo Cục Dự trữ Liên bang Mỹ (Fed) sẽ hạ lãi suất vào tháng 9.","Sat, 31 Aug 2024 06:34:07 +0700",Tài chính - Ngân hàng,Tài chính,2025-07-20 11:42:18
Sơn Hòa Bình cổ phần hóa nhưng không vội trở thành công ty đại chúng,http://vietstock.vn/2024/11/son-hoa-binh-co-phan-hoa-nhung-khong-voi-tro-thanh-cong-ty-dai-chung-746-1249199.htm,"Chiều ngày 29/11/2024, CTCP Sơn và Chất phủ Hòa Bình (HBP) có buổi công bố định hướng chiến lược mới, thay đổi trong tên định danh – hình thức tổ chức – logo nhận diện thương hiệu của doanh nghiệp.","Sat, 30 Nov 2024 11:13:06 +0700",IPO - Cổ phần hóa,Doanh nghiệp,2025-07-20 11:41:50
"1,300 bệnh nhân được hỗ trợ mổ tim và mắt từ Vinamilk",http://vietstock.vn/2024/11/1300-benh-nhan-duoc-ho-tro-mo-tim-va-mat-tu-vinamilk-735-1249207.htm,"Vinamilk tiếp tục cùng Hội Bảo trợ Bệnh nhân nghèo TPHCM để góp phần mang lại trái tim khỏe mạnh hơn cho 300 bệnh nhi mắc dị tật tim bẩm sinh và ánh sáng cho gần 1,000 bệnh nhân nghèo cần được phẫu thuật mắt. Chương trình được Vinamilk thực hiện bền bỉ từ năm 1995 đến nay, với tổng kinh phí hỗ trợ phẫu thuật là hơn 8.2 tỷ đồng.","Sat, 30 Nov 2024 09:57:44 +0700",Vì cộng đồng,Tài chính,2025-07-20 11:42:29
Ly kỳ hành trình trở về của một kiệt tác,http://vietstock.vn/2022/10/ly-ky-hanh-trinh-tro-ve-cua-mot-kiet-tac-4263-1004391.htm,"Sáng ngày 29/11/1985, một cặp đôi bước vào Bảo tàng Nghệ thuật của Đại học Arizona ở Tucson, Arizona. Trong vòng vài phút, “Woman-Ocher” - bức tranh của họa sĩ người Mỹ gốc Hà Lan Willem de Kooning - đã biến mất.","Sat, 29 Oct 2022 20:00:00 +0700",Chơi sang,Tài chính,2025-07-20 11:42:25
Sầu riêng rớt giá vì lý do bất ngờ,http://vietstock.vn/2025/06/sau-rieng-rot-gia-vi-ly-do-bat-ngo-118-1322691.htm,"Giá sầu riêng đang ở mức thấp so với các năm khi bước vào cao điểm thu hoạch, nhiều vườn mới bắt đầu thu hoạch","Sat, 28 Jun 2025 22:26:15 +0700",Nông sản thực phẩm,Hàng hóa,2025-07-20 11:42:03
Chứng khoán phái sinh tuần 30/06-04/07/2025: Triển vọng ngắn hạn khá lạc quan,http://vietstock.vn/2025/06/chung-khoan-phai-sinh-tuan-3006-04072025-trien-vong-ngan-han-kha-lac-quan-1636-1322632.htm,"Các hợp đồng tương lai đồng loạt tăng điểm trong phiên giao dịch ngày 27/06/2025. VN30-Index tăng điểm và đóng cửa gần mức đỉnh 52 tuần mới kèm theo khối lượng giao dịch vượt mức trung bình 20 phiên, cho thấy tâm lý nhà đầu tư tiếp tục lạc quan.","Sat, 28 Jun 2025 20:00:00 +0700",Chứng khoán phái sinh,Chứng khoán,2025-07-20 11:41:39
HOSE “bật đèn xanh” cho TAL chuyển sàn,http://vietstock.vn/2025/06/hose-bat-den-xanh-cho-tal-chuyen-san-741-1322675.htm,"Ngày 27/06/2025, Sở Giao dịch Chứng khoán TPHCM (HOSE) đã có quyết định chấp thuận cho gần 312 triệu cp của CTCP Đầu tư Bất động sản Taseco (UPCoM: TAL) niêm yết trên sàn HOSE.","Sat, 28 Jun 2025 15:19:37 +0700",Niêm yết,Chứng khoán,2025-07-20 11:41:36
"BHXH tự nguyện: Nhà nước hỗ trợ cao nhất 50%, thời gian tối đa 10 năm",http://vietstock.vn/2025/06/bhxh-tu-nguyen-nha-nuoc-ho-tro-cao-nhat-50-thoi-gian-toi-da-10-nam-3113-1322645.htm,"Từ ngày 1/7, người dân tham gia BHXH tự nguyện sẽ được Nhà nước hỗ trợ chi phí đóng theo mức từ 20–50%, tùy đối tượng. Thời gian hỗ trợ lên tới 10 năm, hướng tới đảm bảo an sinh lâu dài cho người lao động không có hợp đồng.","Sat, 28 Jun 2025 09:52:18 +0700",Bảo hiểm,Tài chính,2025-07-20 11:42:06
Vỏ bọc 'thượng lưu' của các đối tượng lừa đảo xuyên quốc gia,http://vietstock.vn/2025/06/vo-boc-thuong-luu-cua-cac-doi-tuong-lua-dao-xuyen-quoc-gia-4260-1322638.htm,"Nhiều đối tượng cầm đầu các đường dây lừa đảo công nghệ cao đã tạo vỏ bọc với cuộc sống xa hoa, sang trọng để chiếm đoạt hàng nghìn tỷ đồng từ các nạn nhân mong muốn làm giàu nhanh chóng trên mạng.","Sat, 28 Jun 2025 08:44:00 +0700",Làm chủ đồng tiền,Tài chính,2025-07-20 11:42:22
"Campuchia cho ngân hàng, tổ chức dịch vụ thanh toán xử lý tài sản kỹ thuật số",http://vietstock.vn/2024/12/campuchia-cho-ngan-hang-to-chuc-dich-vu-thanh-toan-xu-ly-tai-san-ky-thuat-so-1327-1256326.htm,"Tài sản kỹ thuật số bao gồm tài sản truyền thống được mã hóa, tài sản kỹ thuật số không được hỗ trợ, tiền kỹ thuật số ổn định, mã thông báo tiện ích và mã thông báo chứng khoán.","Sat, 28 Dec 2024 08:28:37 +0700",Tài chính - Ngân hàng,Tài chính,2025-07-20 11:42:18
