title,link,description,pub_date,category,section,crawl_time
"KSV muốn thoái hết vốn tại chủ khách sạn Bằng Giang, giá bán gấp 3 lần thị giá",http://vietstock.vn/2025/07/ksv-muon-thoai-het-von-tai-chu-khach-san-bang-giang-gia-ban-gap-3-lan-thi-gia-739-1327868.htm,"HĐQT Tổng Công ty Khoáng sản TKV - CTCP (Vimico, HNX: KSV) ngày 10/07 thống nhất phương án thoái toàn bộ 923.5 ngàn cp (tỷ lệ 51.31%) tại CTCP Du lịch và Thương mại Bằng Giang Cao Bằng - Vimico (UPCoM: BCV) - chủ sở hữu khách sạn Bằng Giang - với giá 61,900 đồng/cp, gấp gần 3 lần thị giá.","Mon, 14 Jul 2025 15:00:00 +0700",Giao dịch nội bộ,Chứng khoán,2025-07-20 11:41:35
"Cấp sổ đỏ lần đầu ở xã trong 3 ngày, không cần xác nhận ‘đất không tranh chấp'",http://vietstock.vn/2025/07/cap-so-do-lan-dau-o-xa-trong-3-ngay-khong-can-xac-nhan-8216dat-khong-tranh-chap-4266-1327883.htm,"Theo quy định tại Nghị định 151/2025, có hiệu lực thi hành từ 1/7, người dân không phải xác nhận đất không tranh chấp khi làm sổ đỏ.","Mon, 14 Jul 2025 14:49:00 +0700",Bảo hiểm và thuế nhà đất,Bất động sản,2025-07-20 11:41:58
"Mirae Asset kỳ vọng VN-Index chinh phục đỉnh cũ 1,550 trong quý 3",http://vietstock.vn/2025/07/mirae-asset-ky-vong-vn-index-chinh-phuc-dinh-cu-1550-trong-quy-3-145-1327698.htm,"Trong báo cáo vĩ mô và chiến lược vừa được đăng tải ngày 10/07, Chứng khoán Mirae Asset Việt Nam kỳ vọng xu hướng tăng sẽ tiếp diễn trong phần còn lại của quý 3 với mục tiêu chinh phục vùng đỉnh lịch sử 1,550 điểm.","Mon, 14 Jul 2025 14:39:46 +0700",Ý kiến chuyên gia,Chứng khoán,2025-07-20 11:41:41
"Hộ, cá nhân kinh doanh chuyển đổi sang doanh nghiệp có thể được miễn thuế thu nhập doanh nghiệp",http://vietstock.vn/2025/07/ho-ca-nhan-kinh-doanh-chuyen-doi-sang-doanh-nghiep-co-the-duoc-mien-thue-thu-nhap-doanh-nghiep-758-1327875.htm,"Tại dự thảo Nghị định quy định chi tiết một số điều của Luật Thuế thu nhập doanh nghiệp, Bộ Tài chính đề xuất quy định về miễn thuế thu nhập doanh nghiệp đối với doanh nghiệp chuyển đổi từ hộ, cá nhân kinh doanh.","Mon, 14 Jul 2025 14:32:00 +0700",Thuế và Ngân sách,Tài chính,2025-07-20 11:42:07
Doanh nghiệp khoáng sản dự chi hơn 16 tỷ đồng cổ tức,http://vietstock.vn/2025/07/doanh-nghiep-khoang-san-du-chi-hon-16-ty-dong-co-tuc-738-1327833.htm,"CTCP Khoáng sản Bình Định (Bimico, HOSE: BMC) thông báo chốt quyền chia cổ tức bằng tiền cho năm 2024. Ngày giao dịch không hưởng quyền là 24/07.","Mon, 14 Jul 2025 14:30:00 +0700",Cổ tức,Doanh nghiệp,2025-07-20 11:41:48
"Lãnh đạo mua bán cổ phiếu: Giao dịch lớn tại SGR, TCO và VCR",http://vietstock.vn/2025/07/lanh-dao-mua-ban-co-phieu-giao-dich-lon-tai-sgr-tco-va-vcr-739-1327866.htm,"Thống kê giao dịch tuần từ ngày 7-11/7/2025, ghi nhận, nhiều thương vụ mua bán cổ phiếu đáng chú ý từ lãnh đạo và người thân, đơn cử tại SGR, TCO, VCR và VSC.","Mon, 14 Jul 2025 14:02:00 +0700",Giao dịch nội bộ,Chứng khoán,2025-07-20 11:41:35
Phân tích kỹ thuật phiên chiều 14/07: Hiện tượng phân hóa đang diễn ra,http://vietstock.vn/2025/07/phan-tich-ky-thuat-phien-chieu-1407-hien-tuong-phan-hoa-dang-dien-ra-585-1327871.htm,VN-Index và Hnx-index mở cửa phân hóa đi kèm với khối lượng giao dịch vượt mức trung bình trong phiên sáng cho thấy tâm lý lạc quan của nhà đầu tư vẫn hiện hữu.,"Mon, 14 Jul 2025 13:32:21 +0700",Phân tích kỹ thuật,Phân tích,2025-07-20 11:42:33
Doanh nghiệp thuộc tập đoàn AB Mauri bị thu hồi gần 2.9ha đất tại Đồng Nai,http://vietstock.vn/2025/07/doanh-nghiep-thuoc-tap-doan-ab-mauri-bi-thu-hoi-gan-29ha-dat-tai-dong-nai-4220-1327865.htm,"Ngày 30/06, UBND tỉnh Đồng Nai ban hành quyết định thu hồi diện tích gần 28.9 ngàn m2 đất của Công ty TNHH AB Mauri Việt Nam tại xã La Ngà. Nguyên nhân do Công ty AB Mauri Việt Nam không được gia hạn sử dụng đất theo quy định tại điểm c, khoản 1, Điều 82 Luật Đất đai năm 2024.","Mon, 14 Jul 2025 13:10:26 +0700",Thị trường nhà đất,Bất động sản,2025-07-20 11:41:54
"Cấm xe máy chạy xăng vào Vành đai 1: 'Cần bàn làm, không bàn lùi'",http://vietstock.vn/2025/07/cam-xe-may-chay-xang-vao-vanh-dai-1-can-ban-lam-khong-ban-lui-4264-1327872.htm,"Nhiều người dân ủng hộ đề xuất cấm xe máy chạy xăng vào Vành đai 1, coi đây là bước đi cần thiết để giảm ùn tắc, ô nhiễm, hướng Hà Nội thành đô thị xanh, văn minh tuy nhiên cũng không ít bạn đọc bày tỏ tâm tư.","Mon, 14 Jul 2025 13:09:35 +0700",Xe - Công nghệ,Tài chính,2025-07-20 11:42:27
Dòng tiền nửa cuối năm: Từ trú ẩn sang tái cơ cấu tài sản,http://vietstock.vn/2025/07/dong-tien-nua-cuoi-nam-tu-tru-an-sang-tai-co-cau-tai-san-145-1327766.htm,"Nửa cuối năm 2025 không phải là giai đoạn dành cho những người tìm kiếm sự “an toàn tuyệt đối”. Nhà đầu tư không còn chỉ phòng thủ mà chuyển sang tái đầu tư, tái cấu trúc vốn, tái phân bổ chiến lược.","Mon, 14 Jul 2025 13:02:00 +0700",Ý kiến chuyên gia,Chứng khoán,2025-07-20 11:41:41
"Vốn ETF ồ ạt chảy vào, Bitcoin chinh phục mốc 120,000 USD",http://vietstock.vn/2025/07/von-etf-o-at-chay-vao-bitcoin-chinh-phuc-moc-120000-usd-4309-1327870.htm,"Bitcoin tiếp tục đà tăng giá mạnh mẽ để lên mức kỷ lục mới trên 120,000 USD trong ngày 14/07, được thúc đẩy bởi dòng vốn từ các quỹ ETF Bitcoin.","Mon, 14 Jul 2025 12:36:54 +0700",Tiền kỹ thuật số,Thế giới,2025-07-20 11:42:12
"Theo dõi gì ở HDG, BAF và ANV?",http://vietstock.vn/2025/07/theo-doi-gi-o-hdg-baf-va-anv-145-1327864.htm,Công ty chứng khoán (CTCK) khuyến nghị mua HDG với hy vọng giá bán tại dự án điện mặt trời Infra 1 không bị điều chỉnh; giữ BAF nhờ kỳ vọng giá heo được kỳ vọng neo ở mức cao cho đến hết năm 2025; theo dõi ANV nhờ giá xuất khẩu tăng trong khi giá thành nuôi cá giảm.,"Mon, 14 Jul 2025 12:23:20 +0700",Ý kiến chuyên gia,Chứng khoán,2025-07-20 11:41:41
"Chủ tịch TNH muốn bán 5 triệu cp, rút khỏi nhóm cổ đông lớn",http://vietstock.vn/2025/07/chu-tich-tnh-muon-ban-5-trieu-cp-rut-khoi-nhom-co-dong-lon-739-1327821.htm,"Chủ tịch đăng ký bán 5 triệu cp TNH, dự kiến thu về ít nhất 84 tỷ đồng và rút khỏi danh sách cổ đông lớn. Động thái diễn ra khi Doanh nghiệp vừa công bố lỗ ròng quý 1, đồng thời cơ cấu lại toàn bộ HĐQT.","Mon, 14 Jul 2025 12:00:00 +0700",Giao dịch nội bộ,Chứng khoán,2025-07-20 11:41:35
Trái phiếu riêng lẻ tháng 6/2025 bùng nổ với 123 ngàn tỷ đổ vào thị trường,http://vietstock.vn/2025/07/trai-phieu-rieng-le-thang-62025-bung-no-voi-123-ngan-ty-do-vao-thi-truong-3118-1327783.htm,"Sau nhiều tháng tăng tốc, giá trị phát hành trái phiếu doanh nghiệp riêng lẻ trong tháng 6 tiếp tục đạt đỉnh mới với 106 đợt, huy động gần 123.7 ngàn tỷ đồng, tăng 67% so với tháng trước.","Mon, 14 Jul 2025 11:38:50 +0700",Trái phiếu doanh nghiệp,Doanh nghiệp,2025-07-20 11:41:53
"VVS chia cổ tức lần đầu từ khi lên sàn, gia đình Chủ tịch hưởng lợi lớn",http://vietstock.vn/2025/07/vvs-chia-co-tuc-lan-dau-tu-khi-len-san-gia-dinh-chu-tich-huong-loi-lon-738-1327805.htm,"CTCP Đầu tư phát triển máy Việt Nam (VIMID, UPCoM: VVS) thông báo chốt quyền trả cổ tức năm 2024 theo tỷ lệ 10% (1,000 đồng/cp), ngày giao dịch không hưởng quyền là 23/07. Đây cũng là lần đầu tiên Công ty chia cổ tức từ khi cổ phiếu lên sàn UPCoM vào tháng 10/2022.","Mon, 14 Jul 2025 11:15:00 +0700",Cổ tức,Doanh nghiệp,2025-07-20 11:41:48
Không để tái diễn việc yêu cầu người dân cung cấp giấy tờ trùng lặp với dữ liệu,http://vietstock.vn/2025/07/khong-de-tai-dien-viec-yeu-cau-nguoi-dan-cung-cap-giay-to-trung-lap-voi-du-lieu-4265-1327862.htm,"Ông Phạm Đức Long, Thứ trưởng Bộ KH&amp;CN cho biết, Bộ sẽ kiên quyết không để tái diễn tình trạng yêu cầu người dân cung cấp giấy tờ trùng lặp với dữ liệu đã có trong các cơ sở dữ liệu quốc gia như dân cư, đất đai…","Mon, 14 Jul 2025 11:11:52 +0700",Tiêu dùng và lối sống,Tài chính,2025-07-20 11:42:28
"Trò chơi tiền tệ, khi vàng và Bitcoin trở thành biện pháp “tự vệ chính đáng”",http://vietstock.vn/2025/07/tro-choi-tien-te-khi-vang-va-bitcoin-tro-thanh-bien-phap-tu-ve-chinh-dang-772-1327775.htm,"Trên toàn cầu, ngày càng nhiều người dân, từ cá nhân cho tới các định chế tài chính, đều tỏ ra mệt mỏi với những “trò chơi tiền tệ” của các ngân hàng trung ương. Biểu hiện rõ nét là làn sóng dịch chuyển tài sản sang các kênh phi tập trung như vàng và Bitcoin ngày càng mạnh mẽ. Đây không chỉ là câu chuyện lợi nhuận. Đó là một hành vi “tự vệ chính đáng” trong bối cảnh đồng tiền truyền thống biến động khó lường, lạm phát bào mòn giá trị, còn chính sách tiền tệ dường như bị chính trị hóa. Sự chuyển dịch này ngầm gửi đi một thông điệp: Người dân không còn muốn chơi theo luật tiền tệ do ngân hàng trung ương đạo diễn.","Mon, 14 Jul 2025 11:02:00 +0700",Tài chính quốc tế,Tài chính,2025-07-20 11:42:14
Chi tiết những dự án bất động sản mang về cho TPHCM hơn 65.300 tỷ đồng,http://vietstock.vn/2025/07/chi-tiet-nhung-du-an-bat-dong-san-mang-ve-cho-tphcm-hon-65300-ty-dong-4266-1327813.htm,"9 dự án bất động sản trên địa bàn TPHCM trước khi sáp nhập, mở rộng địa giới hành chính, dự kiến sẽ thu về cho ngân sách 52.599 tỷ đồng. Trong đó, có nhiều dự án lớn như Vinhomes Green Paradise nộp 27.317 tỷ đồng, dự án Lotte Eco Smart City nộp 16.190 tỷ đồng...","Mon, 14 Jul 2025 10:04:21 +0700",Bảo hiểm và thuế nhà đất,Bất động sản,2025-07-20 11:41:58
Tuần 14-18/07/2025: 10 cổ phiếu nóng dưới góc nhìn PTKT của Vietstock,http://vietstock.vn/2025/07/tuan-14-18072025-10-co-phieu-nong-duoi-goc-nhin-ptkt-cua-vietstock-585-1327642.htm,"Các cổ phiếu nóng được phân tích trong báo cáo của Phòng Tư vấn Vietstock gồm: CTG, DBC, DGW, DIG, STB, SHB, TCB, VPB, VHC, VCB.","Mon, 14 Jul 2025 10:00:00 +0700",Phân tích kỹ thuật,Phân tích,2025-07-20 11:42:33
Đơn vị liên quan Chủ tịch SJS tăng sở hữu trước thềm đợt tăng vốn gấp 2.6 lần,http://vietstock.vn/2025/07/don-vi-lien-quan-chu-tich-sjs-tang-so-huu-truoc-them-dot-tang-von-gap-26-lan-739-1327768.htm,CTCP Chứng khoán Quốc Gia (NSI) - đơn vị liên quan đến Chủ tịch HĐQT CTCP SJ Group (HOSE: SJS) - đã mua thỏa thuận 1.6 triệu cp trong 2 phiên 09-10/07.,"Mon, 14 Jul 2025 10:00:00 +0700",Giao dịch nội bộ,Chứng khoán,2025-07-20 11:41:35
"Vinatex Đà Nẵng sắp chi cổ tức 2,000 đồng/cp",http://vietstock.vn/2025/07/vinatex-da-nang-sap-chi-co-tuc-2000-dongcp-738-1327767.htm,CTCP Vinatex Đà Nẵng (UPCoM: VDN) thông báo chốt quyền chia cổ tức bằng tiền cho năm 2024. Ngày giao dịch không hưởng quyền là 23/07.,"Mon, 14 Jul 2025 09:42:20 +0700",Cổ tức,Doanh nghiệp,2025-07-20 11:41:48
Mua đất giấy tờ viết tay có được cấp sổ đỏ?,http://vietstock.vn/2025/07/mua-dat-giay-to-viet-tay-co-duoc-cap-so-do-4266-1327798.htm,Ông Nguyễn Hồng Phong ở TPHCM kiến nghị Bộ Nông nghiệp và Môi trường (NN&amp;MT) làm rõ việc cấp sổ đỏ cho thửa đất mua bằng hợp đồng “giấy viết tay”.,"Mon, 14 Jul 2025 09:35:08 +0700",Bảo hiểm và thuế nhà đất,Bất động sản,2025-07-20 11:41:58
"Sau sáp nhập, có tiền tỷ đầu tư bất động sản cần đặc biệt lưu ý những điều này",http://vietstock.vn/2025/07/sau-sap-nhap-co-tien-ty-dau-tu-bat-dong-san-can-dac-biet-luu-y-nhung-dieu-nay-4220-1327770.htm,"Nhà đầu tư có sẵn vài tỷ đồng băn khoăn nên đầu tư bất động sản khu vực nào tiềm năng, phân khúc nào có thể sinh lời. Đặc biệt, cần lưu ý gì để tránh rủi ro khi ‘xuống tiền’?","Mon, 14 Jul 2025 09:30:00 +0700",Thị trường nhà đất,Bất động sản,2025-07-20 11:41:54
Mỹ áp thuế 50% với đồng nhập khẩu: Tác động không đáng kể tới trong nước,http://vietstock.vn/2025/07/my-ap-thue-50-voi-dong-nhap-khau-tac-dong-khong-dang-ke-toi-trong-nuoc-742-1327778.htm,Một trong những lý do cốt lõi giúp các doanh nghiệp Việt Nam giữ được sự ổn định trước biến động quốc tế khi Mỹ áp thuế 50% với đồng nhập khẩu là định hướng phát triển mạnh mẽ thị trường nội địa.,"Mon, 14 Jul 2025 09:00:05 +0700",Kim loại,Hàng hóa,2025-07-20 11:42:02
Thủ tướng yêu cầu Hà Nội lên phương án loại bỏ xe máy chạy xăng trong vành đai 1,http://vietstock.vn/2025/07/thu-tuong-yeu-cau-ha-noi-len-phuong-an-loai-bo-xe-may-chay-xang-trong-vanh-dai-1-4264-1327769.htm,"Các địa phương, đặc biệt là Hà Nội, được yêu cầu xây dựng vùng phát thải thấp, hạn chế xe dùng nhiên liệu hóa thạch. Mục tiêu từ 1/7/2026 không có xe mô tô, xe gắn máy sử dụng nhiên liệu hóa thạch lưu thông trong vành đai 1.","Mon, 14 Jul 2025 08:42:00 +0700",Xe - Công nghệ,Tài chính,2025-07-20 11:42:27
"Bộ Công an đề xuất kiểm soát giá mua, bán vàng miếng, Ngân hàng Nhà nước nói gì?",http://vietstock.vn/2025/07/bo-cong-an-de-xuat-kiem-soat-gia-mua-ban-vang-mieng-ngan-hang-nha-nuoc-noi-gi-759-1327765.htm,"Bộ Công an cho rằng cần nghiên cứu, xem xét bổ sung quy định về cơ chế quản lý, biện pháp quản lý giá mua, bán vàng miếng. Ngoài ra, cần bổ sung quy định về biên độ chênh lệch tối đa giữa giá mua và giá bán vàng miếng.","Mon, 14 Jul 2025 08:30:00 +0700",Vàng và kim loại quý,Hàng hóa,2025-07-20 11:42:00
Người dân xin cấp sổ đỏ phải chờ bao lâu khi thực hiện chính quyền 2 cấp?,http://vietstock.vn/2025/07/nguoi-dan-xin-cap-so-do-phai-cho-bao-lau-khi-thuc-hien-chinh-quyen-2-cap-4220-1327758.htm,Bộ NN-MT đã có hướng dẫn chi tiết quy trình cấp sổ đỏ khi thực hiện chính quyền 2 cấp.,"Mon, 14 Jul 2025 07:00:00 +0700",Thị trường nhà đất,Bất động sản,2025-07-20 11:41:54
"Hạ tầng logistics là chìa khóa để TPHCM hiện thực hóa ""siêu đô thị"" bán lẻ",http://vietstock.vn/2025/07/ha-tang-logistics-la-chia-khoa-de-tphcm-hien-thuc-hoa-sieu-do-thi-ban-le-4265-1327757.htm,"Với hệ thống cảng biển, kho vận, thị trường rộng 14 triệu dân, TPHCM đang chủ động vẽ lại bản đồ phân phối hàng hóa và tiêu dùng bằng hạ tầng logistics thông minh, kết nối liên vùng.","Mon, 14 Jul 2025 06:45:00 +0700",Tiêu dùng và lối sống,Tài chính,2025-07-20 11:42:28
Bộ Nội vụ kiến nghị rà soát toàn diện hạ tầng hành chính công cấp xã,http://vietstock.vn/2025/07/bo-noi-vu-kien-nghi-ra-soat-toan-dien-ha-tang-hanh-chinh-cong-cap-xa-761-1327755.htm,"Hạn chế về hạ tầng kỹ thuật đang gây nghẽn hệ thống hành chính công tại nhiều địa phương. Bộ trưởng Bộ Nội vụ Phạm Thị Thanh Trà kiến nghị Thủ tướng cho kiểm tra toàn tuyến, đồng thời đẩy mạnh đào tạo cán bộ và hoàn thiện khung pháp lý vận hành chính quyền địa phương hai cấp.","Mon, 14 Jul 2025 06:15:00 +0700",Vĩ mô,Kinh tế,2025-07-20 11:42:08
Tài khoản giao dịch chứng khoán trên sàn Campuchia tăng gần 32% trong quý 1,http://vietstock.vn/2024/05/tai-khoan-giao-dich-chung-khoan-tren-san-campuchia-tang-gan-32-trong-quy-1-1328-1189562.htm,"Số lượng tài khoản giao dịch trên Sở Giao dịch Chứng khoán Campuchia (CSX) tính đến cuối quý 1 năm nay tăng lên 51,044 tài khoản, tăng 31.67% so với cùng kỳ năm ngoái, Khmer Time đưa tin.","Mon, 13 May 2024 17:14:18 +0700",Thị trường chứng khoán,Chứng khoán,2025-07-20 11:42:19
Xe mô tô giá 1 tỷ đồng của Honda bị triệu hồi,http://vietstock.vn/2022/04/xe-mo-to-gia-1-ty-dong-cua-honda-bi-trieu-hoi-4264-951852.htm,"14 chiếc xe mô tô Honda CBR1000RR-R Fireblade trị giá từ 949 triệu đến 1,049 tỷ đồng đang bị triệu hồi.","Mon, 11 Apr 2022 20:27:13 +0700",Chơi sang,Tài chính,2025-07-20 11:42:25
Campuchia kỳ vọng tăng trưởng kinh tế đạt 6.3% trong năm 2025,http://vietstock.vn/2025/02/campuchia-ky-vong-tang-truong-kinh-te-dat-63-trong-nam-2025-1326-1270289.htm,"Theo báo cáo Ngân sách tóm tắt cho tài khóa 2025 được Bộ Kinh tế và Tài chính (MEF) công bố gần đây, nền kinh tế Campuchia được dự báo sẽ đạt mức tăng trưởng 6.3% trong năm nay, Khmer Times đưa tin.","Mon, 10 Feb 2025 21:02:00 +0700",Vĩ mô,Đông Dương,2025-07-20 11:42:16
"Một doanh nghiệp nước địa phương rời UPCoM giữa lúc kinh doanh lập đỉnh, cổ tức đều đặn",http://vietstock.vn/2025/06/mot-doanh-nghiep-nuoc-dia-phuong-roi-upcom-giua-luc-kinh-doanh-lap-dinh-co-tuc-deu-dan-741-1316239.htm,"Cổ phiếu CTCP Nước sạch Quảng Trị (UPCoM: NQT) sẽ bị hủy giao dịch từ ngày 02/07 - sau gần 9 năm lên UPCoM, với thanh khoản gần như đóng băng suốt từ cuối 2023. Trong khi đó, Doanh nghiệp vẫn duy trì đà tăng trưởng lợi nhuận 7 năm liên tiếp, cổ tức tăng đều mỗi năm, và hàng trăm lao động gắn bó.","Mon, 09 Jun 2025 12:00:00 +0700",Niêm yết,Chứng khoán,2025-07-20 11:41:36
"Hợp nhất 2 doanh nghiệp, ""tân binh"" ngành than chào sàn HNX với giá 11,700 đồng/cp",http://vietstock.vn/2025/06/hop-nhat-2-doanh-nghiep-tan-binh-nganh-than-chao-san-hnx-voi-gia-11700-dongcp-741-1316219.htm,"Hơn 61.9 triệu cp TD6 của CTCP Than Đèo Nai - Cọc Sáu - TKV sẽ giao dịch trên HNX từ ngày 16/06, với giá tham chiếu 11,700 đồng/cp - tương đương vốn hóa chào sàn gần 725 tỷ đồng. Đây là công ty được hợp nhất từ 2 đơn vị thành viên của TKV theo đề án tái cơ cấu ngành than.","Mon, 09 Jun 2025 11:30:00 +0700",Niêm yết,Chứng khoán,2025-07-20 11:41:36
"Vietstock tài trợ quỹ học bổng, tăng cường hợp tác cùng trường Cao đẳng Kinh tế Đối ngoại",http://vietstock.vn/2025/06/vietstock-tai-tro-quy-hoc-bong-tang-cuong-hop-tac-cung-truong-cao-dang-kinh-te-doi-ngoai-735-1316255.htm,"Vừa qua, trong khuôn khổ chương trình “Talkshow, Ký kết hợp tác doanh nghiệp & Ra mắt Câu lạc bộ Cựu sinh viên”, Vietstock đã tài trợ quỹ học bổng trị giá 23,500,000 đồng dành cho Trường Cao đẳng Kinh tế Đối ngoại.","Mon, 09 Jun 2025 10:45:00 +0700",Vì cộng đồng,Tài chính,2025-07-20 11:42:29
"Warren Buffett: Quên quy tắc 10,000 giờ đi, để thành công cần làm điều này",http://vietstock.vn/2025/07/warren-buffett-quen-quy-tac-10000-gio-di-de-thanh-cong-can-lam-dieu-nay-4265-1325887.htm,"Với giá trị tài sản ròng ước tính khoảng 160 tỷ USD, Warren Buffett có thể được xem là một hiện tượng hiếm có. Tuy nhiên, nhà đầu tư huyền thoại này không tin vào quy tắc 10,000 giờ. Theo ông, nếu muốn trở thành một nhà đầu tư giỏi, bạn hoàn toàn có thể, nhưng chỉ cần hiểu rằng thực hành quy tắc 10,000 giờ không nhất thiết sẽ đưa bạn đến thành công.","Mon, 07 Jul 2025 20:49:05 +0700",Đầu tư – Kinh doanh nhỏ,Tài chính,2025-07-20 11:42:23
"Warren Buffett: Quên quy tắc 10,000 giờ đi, để thành công cần làm điều này",http://vietstock.vn/2025/07/warren-buffett-quen-quy-tac-10000-gio-di-de-thanh-cong-can-lam-dieu-nay-4265-1325887.htm,"Với giá trị tài sản ròng ước tính khoảng 160 tỷ USD, Warren Buffett có thể được xem là một hiện tượng hiếm có. Tuy nhiên, nhà đầu tư huyền thoại này không tin vào quy tắc 10,000 giờ. Theo ông, nếu muốn trở thành một nhà đầu tư giỏi, bạn hoàn toàn có thể, nhưng chỉ cần hiểu rằng thực hành quy tắc 10,000 giờ không nhất thiết sẽ đưa bạn đến thành công.","Mon, 07 Jul 2025 20:49:05 +0700",Doanh nhân và khởi nghiệp,Tài chính,2025-07-20 11:42:24
"Warren Buffett: Quên quy tắc 10,000 giờ đi, để thành công cần làm điều này",http://vietstock.vn/2025/07/warren-buffett-quen-quy-tac-10000-gio-di-de-thanh-cong-can-lam-dieu-nay-4265-1325887.htm,"Với giá trị tài sản ròng ước tính khoảng 160 tỷ USD, Warren Buffett có thể được xem là một hiện tượng hiếm có. Tuy nhiên, nhà đầu tư huyền thoại này không tin vào quy tắc 10,000 giờ. Theo ông, nếu muốn trở thành một nhà đầu tư giỏi, bạn hoàn toàn có thể, nhưng chỉ cần hiểu rằng thực hành quy tắc 10,000 giờ không nhất thiết sẽ đưa bạn đến thành công.","Mon, 07 Jul 2025 20:49:05 +0700",Tiêu dùng và lối sống,Tài chính,2025-07-20 11:42:28
Cựu Tổng Giám đốc Petrolimex Đào Nam Hải bị khởi tố,http://vietstock.vn/2025/07/cuu-tong-giam-doc-petrolimex-dao-nam-hai-bi-khoi-to-214-1325889.htm,"Tại Họp báo thông báo tình hình, kết quả các mặt công tác công an 6 tháng đầu năm 2025 do Bộ Công an tổ chức vào chiều 07/07/2025, Thượng tá Vũ Thanh Tùng - Phó Cục trưởng Cục Cảnh sát điều tra tội phạm về tham nhũng, kinh tế, buôn lậu, Bộ Công an đã thông tin liên quan vụ án xảy ra tại Tổng CTCP Bảo hiểm Petrolimex (PJICO, HOSE: PGI) và các đơn vị liên quan.","Mon, 07 Jul 2025 20:47:00 +0700",Nhân vật,Doanh nghiệp,2025-07-20 11:41:52
"Campuchia phê duyệt 7 dự án đầu tư mới, kỳ vọng tạo thêm 2,000 việc làm",http://vietstock.vn/2025/07/campuchia-phe-duyet-7-du-an-dau-tu-moi-ky-vong-tao-them-2000-viec-lam-1329-1325886.htm,"Ngày 07/07, Chính phủ Hoàng gia Campuchia, thông qua Hội đồng Phát triển Campuchia, đã quyết định và phê duyệt 7 dự án đầu tư đủ điều kiện (QIP) với tổng vốn đầu tư khoảng 123 triệu USD. Các dự án này được dự báo sẽ tạo ra khoảng 2,000 việc làm.","Mon, 07 Jul 2025 20:32:18 +0700",Kinh tế - Đầu tư,Kinh tế,2025-07-20 11:42:20
Campuchia chuẩn bị chính sách phát triển công nghiệp và nông nghiệp ở khu vực phía Tây,http://vietstock.vn/2025/07/campuchia-chuan-bi-chinh-sach-phat-trien-cong-nghiep-va-nong-nghiep-o-khu-vuc-phia-tay-1326-1325706.htm,"Chính phủ Hoàng gia Campuchia (RGC) sẽ xây dựng một chính sách quốc gia nhằm thúc đẩy lĩnh vực công - nông nghiệp ở khu vực phía Tây đất nước như một phần trong nỗ lực đa dạng hóa nền kinh tế quốc gia, Thủ tướng Hun Manet tuyên bố hôm 01/07.","Mon, 07 Jul 2025 20:02:00 +0700",Vĩ mô,Đông Dương,2025-07-20 11:42:16
Thị trường chứng quyền ngày 08/07/2025: Tâm lý lạc quan lan tỏa khắp thị trường,http://vietstock.vn/2025/07/thi-truong-chung-quyen-ngay-08072025-tam-ly-lac-quan-lan-toa-khap-thi-truong-1636-1325640.htm,"Kết thúc phiên giao dịch ngày 07/07/2025, toàn thị trường có 154 mã tăng, 30 mã giảm và 16 mã tham chiếu. Khối ngoại tiếp tục mua ròng với tổng mức mua ròng đạt 2.12 triệu CW.","Mon, 07 Jul 2025 20:00:00 +0700",Chứng quyền,Chứng khoán,2025-07-20 11:41:40
Chứng khoán phái sinh ngày 08/07/2025: Các tín hiệu đang ủng hộ phe Long,http://vietstock.vn/2025/07/chung-khoan-phai-sinh-ngay-08072025-cac-tin-hieu-dang-ung-ho-phe-long-1636-1325628.htm,Các hợp đồng tương lai đồng loạt tăng điểm trong phiên giao dịch ngày 07/07/2025. VN30-Index tăng điểm đồng thời lập đỉnh 52 tuần mới cùng khối lượng có sự gia tăng đột biến và vượt mức trung bình 20 phiên cho thấy nhà đầu tư đã giao dịch sôi động hơn.,"Mon, 07 Jul 2025 19:30:00 +0700",Chứng khoán phái sinh,Chứng khoán,2025-07-20 11:41:39
