title,link,description,pub_date,category,section,crawl_time
Chứng khoán phái sinh ngày 09/07/2025: Triển vọng ngắn hạn tiếp tục khởi sắc,http://vietstock.vn/2025/07/chung-khoan-phai-sinh-ngay-09072025-trien-vong-ngan-han-tiep-tuc-khoi-sac-1636-1326114.htm,Các hợp đồng tương lai đồng loạt tăng điểm trong phiên giao dịch ngày 08/07/2025. VN30-Index tăng điểm kèm theo khối lượng giao dịch vượt mức trung bình 20 phiên cho thấy tâm lý nhà đầu tư tiếp tục lạc quan.,"Tue, 08 Jul 2025 19:30:00 +0700",Chứng khoán phái sinh,Chứng khoán,2025-07-20 11:41:39
"Chờ niêm yết HOSE, VAB giao dịch lần cuối trên UPCoM vào ngày 09/07",http://vietstock.vn/2025/07/cho-niem-yet-hose-vab-giao-dich-lan-cuoi-tren-upcom-vao-ngay-0907-741-1326192.htm,Sở Giao dịch Chứng khoán Hà Nội (HNX) vừa thông báo hủy giao dịch đối với cổ phiếu VAB của Ngân hàng TMCP Việt Á (UPCoM: VAB).,"Tue, 08 Jul 2025 18:04:54 +0700",Niêm yết,Chứng khoán,2025-07-20 11:41:36
Một doanh nghiệp khoáng sản thông qua trả cổ tức 55% bằng cổ phiếu,http://vietstock.vn/2025/07/mot-doanh-nghiep-khoang-san-thong-qua-tra-co-tuc-55-bang-co-phieu-738-1326138.htm,"HĐQT CTCP Kỹ nghệ Khoáng sản Quảng Nam (Minco, HNX: MIC) thông qua phương án phát hành cổ phiếu trả cổ tức năm 2024, tỷ lệ tới 55%.","Tue, 08 Jul 2025 17:38:10 +0700",Cổ tức,Doanh nghiệp,2025-07-20 11:41:48
Dòng vốn tín dụng định hình kinh tế Campuchia ra sao?,http://vietstock.vn/2025/07/dong-von-tin-dung-dinh-hinh-kinh-te-campuchia-ra-sao-1327-1326154.htm,Dòng tín dụng đóng vai trò quan trọng đối với tăng trưởng kinh tế và ổn định tài chính của Campuchia.,"Tue, 08 Jul 2025 17:32:40 +0700",Tài chính - Ngân hàng,Tài chính,2025-07-20 11:42:18
"Sau miễn phép xây dựng, TPHCM bỏ thủ tục hoàn công nhà ở được không?",http://vietstock.vn/2025/07/sau-mien-phep-xay-dung-tphcm-bo-thu-tuc-hoan-cong-nha-o-duoc-khong-4266-1326117.htm,"Từ việc nhà riêng lẻ tại hàng trăm dự án ở TPHCM được miễn phép xây dựng, có ý kiến cho rằng nên bỏ thủ tục hoàn công. Chuyên gia nói về vấn đề này như thế nào?","Tue, 08 Jul 2025 16:37:00 +0700",Bảo hiểm và thuế nhà đất,Bất động sản,2025-07-20 11:41:58
Xuất khẩu nông lâm thủy sản: Thách thức và cơ hội đan xen để cán mốc 65 tỷ USD,http://vietstock.vn/2025/07/xuat-khau-nong-lam-thuy-san-thach-thuc-va-co-hoi-dan-xen-de-can-moc-65-ty-usd-118-1326048.htm,"Với đà phục hồi xuất khẩu nhiều nhóm hàng và các giải pháp quyết liệt, ngành nông nghiệp kỳ vọng cán đích mục tiêu xuất khẩu 65 tỷ USD, góp phần đảm bảo thu nhập ổn định cho nông dân.","Tue, 08 Jul 2025 15:02:00 +0700",Nông sản thực phẩm,Hàng hóa,2025-07-20 11:42:03
"Cần nới quản lý, giảm thủ tục cho các sàn thương mại điện tử nhỏ",http://vietstock.vn/2025/07/can-noi-quan-ly-giam-thu-tuc-cho-cac-san-thuong-mai-dien-tu-nho-4265-1326096.htm,"VCCI cho rằng thương mại điện tử đã là một xu thế tất yếu, cần nghiên cứu cắt giảm thủ tục hành chính của hoạt động này và đẩy mạnh sang hậu kiểm.","Tue, 08 Jul 2025 14:55:00 +0700",Tiêu dùng và lối sống,Tài chính,2025-07-20 11:42:28
"Vietnam Airlines chốt ngày chào bán 900 triệu cp, giá 10,000 đồng",http://vietstock.vn/2025/07/vietnam-airlines-chot-ngay-chao-ban-900-trieu-cp-gia-10000-dong-764-1326020.htm,"Hãng hàng không quốc gia chuẩn bị phát hành 900 triệu cổ phiếu mới để huy động 9,000 tỷ đồng.","Tue, 08 Jul 2025 14:45:15 +0700",Tăng vốn - M&A,Doanh nghiệp,2025-07-20 11:41:49
Phân tích kỹ thuật phiên chiều 08/07: Tâm lý lạc quan vẫn còn,http://vietstock.vn/2025/07/phan-tich-ky-thuat-phien-chieu-0807-tam-ly-lac-quan-van-con-585-1326014.htm,VN-Index và HNX-Index đồng loạt mở cửa tăng điểm đi kèm với sự cải thiện nhẹ trong khối lượng giao dịch cho thấy tâm lý phân vân của nhà đầu tư.,"Tue, 08 Jul 2025 13:34:34 +0700",Phân tích kỹ thuật,Phân tích,2025-07-20 11:42:33
SeABankers Vì trẻ thơ - Một thập kỷ yêu thương khởi nguồn từ trái tim,http://vietstock.vn/2025/07/seabankers-vi-tre-tho-mot-thap-ky-yeu-thuong-khoi-nguon-tu-trai-tim-735-1326013.htm,“Hành động nhỏ hôm nay sẽ làm nên điều diệu kỳ cho thế hệ trẻ mai sau” là tinh thần xuyên suốt hành trình 10 năm của chương trình “SeABankers Vì trẻ thơ” - sáng kiến thiện nguyện đầy tính nhân văn do chính cán bộ nhân viên (CBNV) Ngân hàng TMCP Đông Nam Á (SeABank) khởi xướng và thực hiện từ năm 2015 đến nay.,"Tue, 08 Jul 2025 13:02:00 +0700",Vì cộng đồng,Tài chính,2025-07-20 11:42:29
Tổng Giám đốc Nhựa Pha Lê muốn chi 40 tỷ mua cổ phần riêng lẻ,http://vietstock.vn/2025/07/tong-giam-doc-nhua-pha-le-muon-chi-40-ty-mua-co-phan-rieng-le-764-1325970.htm,"Bà Trần Hải Yến - Tổng Giám đốc kiêm Thành viên HĐQT CTCP Sản xuất và Công nghệ Nhựa Pha Lê (HOSE: PLP) - nằm trong danh sách đăng ký mua 4 triệu cp trong đợt chào bán riêng lẻ sắp tới, tương ứng khoản đầu tư 40 tỷ đồng. Nếu giao dịch hoàn tất, bà Yến sẽ nâng tỷ lệ sở hữu tại PLP lên 4.7%.","Tue, 08 Jul 2025 12:00:00 +0700",Tăng vốn - M&A,Doanh nghiệp,2025-07-20 11:41:49
"Khủng hoảng Samsung: Lợi nhuận sụt 56%, thua đau SK Hynix trong cuộc chiến chip AI, nhân viên rời đi",http://vietstock.vn/2025/07/khung-hoang-samsung-loi-nhuan-sut-56-thua-dau-sk-hynix-trong-cuoc-chien-chip-ai-nhan-vien-roi-di-773-1325971.htm,Samsung Electronics đang chìm sâu hơn vào khủng hoảng khi lợi nhuận thấp nhất kể từ năm 2023 và thất thế trong cuộc đua chip với đối thủ SK Hynix.,"Tue, 08 Jul 2025 11:25:06 +0700",Chứng khoán thế giới,Chứng khoán,2025-07-20 11:42:11
"Vi phạm quy hoạch, xây dựng hàng nghìn căn hộ KĐT Thanh Hà chưa được cấp sổ",http://vietstock.vn/2025/07/vi-pham-quy-hoach-xay-dung-hang-nghin-can-ho-kdt-thanh-ha-chua-duoc-cap-so-4266-1325997.htm,"Theo UBND TP Hà Nội, người dân mua nhà tại các toà chung cư thuộc khu đô thị Thanh Hà chưa được cấp giấy chứng nhận quyền sử dụng đất, quyền sở hữu nhà ở (sổ hồng-PV) do dự án có sự chuyển nhượng giữa các chủ đầu tư khi cơ quan có thẩm quyền chưa cho phép. Đồng thời, dự án có vi phạm về quy hoạch, trật tự xây dựng.","Tue, 08 Jul 2025 11:15:00 +0700",Bảo hiểm và thuế nhà đất,Bất động sản,2025-07-20 11:41:58
Vụ TikToker Mr Pips Phó Đức Nam lừa đảo: Bắt vợ của Mr Hunter khi đang trốn ở Thái Lan,http://vietstock.vn/2025/07/vu-tiktoker-mr-pips-pho-duc-nam-lua-dao-bat-vo-cua-mr-hunter-khi-dang-tron-o-thai-lan-4260-1325959.htm,"Theo Giám đốc Công an TP Hà Nội, Công an TP Hà Nội đã phối hợp với Interpol bắt giữ Ngô Thị Thêu, vợ của Lê Khắc Ngọ khi đang trốn ở Thái Lan.","Tue, 08 Jul 2025 10:03:00 +0700",Làm chủ đồng tiền,Tài chính,2025-07-20 11:42:22
Ngày 08/07/2025: 10 cổ phiếu nóng dưới góc nhìn PTKT của Vietstock,http://vietstock.vn/2025/07/ngay-08072025-10-co-phieu-nong-duoi-goc-nhin-ptkt-cua-vietstock-585-1325699.htm,"Các cổ phiếu nóng được phân tích trong báo cáo của Phòng Tư vấn Vietstock gồm: CTG, DBC, DGW, DIG, STB, SHB, TCB, VPB, VHC, VCB.","Tue, 08 Jul 2025 10:00:00 +0700",Phân tích kỹ thuật,Phân tích,2025-07-20 11:42:33
Chủ thương hiệu mì Miliket chốt quyền chia cổ tức thấp kỷ lục,http://vietstock.vn/2025/07/chu-thuong-hieu-mi-miliket-chot-quyen-chia-co-tuc-thap-ky-luc-738-1325716.htm,"CTCP Lương thực Thực phẩm Colusa - Miliket (UPCoM: CMN), chủ sở hữu thương hiệu mì gói ""hai con tôm"" lâu đời tại Việt Nam, thông báo chốt quyền chia cổ tức 2024 bằng tiền. Ngày giao dịch không hưởng quyền là 11/07.","Tue, 08 Jul 2025 09:45:00 +0700",Cổ tức,Doanh nghiệp,2025-07-20 11:41:48
Prudential Việt Nam có Tổng Giám đốc mới,http://vietstock.vn/2025/07/prudential-viet-nam-co-tong-giam-doc-moi-214-1325908.htm,"Ngày 7/7, Công ty TNHH Bảo hiểm Nhân thọ Prudential Việt Nam (Prudential Việt Nam) thông báo ông Kevin Joong Kwon đảm nhận vai trò Tổng Giám đốc công ty.","Tue, 08 Jul 2025 08:44:49 +0700",Nhân vật,Doanh nghiệp,2025-07-20 11:41:52
Dầu tăng hơn 1% bất chấp quyết định tăng sản lượng từ OPEC+,http://vietstock.vn/2025/07/dau-tang-hon-1-bat-chap-quyet-dinh-tang-san-luong-tu-opec-34-1325904.htm,Giá dầu đã tăng vào ngày thứ Hai (07/07) khi giới đầu tư bỏ qua tác động của việc OPEC+ tăng sản lượng nhiều hơn dự báo trong tháng 8 cũng như lo ngại về tác động tiềm tàng của chính sách thuế quan Mỹ.,"Tue, 08 Jul 2025 07:53:48 +0700",Nhiên liệu,Hàng hóa,2025-07-20 11:42:01
"Dow Jones sụt hơn 400 điểm, giảm mạnh nhất kể từ giữa tháng 6/2025",http://vietstock.vn/2025/07/dow-jones-sut-hon-400-diem-giam-manh-nhat-ke-tu-giua-thang-62025-773-1325902.htm,"Chứng khoán Mỹ bị bán tháo vào đầu tuần trong ngày thứ Hai (07/07), sau khi Tổng thống Mỹ Donald Trump gửi thư cho các quốc gia nêu rõ mức thuế mới đối với hàng hoá nhập khẩu.","Tue, 08 Jul 2025 07:48:58 +0700",Chứng khoán thế giới,Chứng khoán,2025-07-20 11:42:11
"Thứ trưởng Bộ Tài chính: ""Nâng hạng TTCK giống như thi giọng hát, vừa cần giám khảo, vừa cần khán giả""",http://vietstock.vn/2025/05/thu-truong-bo-tai-chinh-nang-hang-ttck-giong-nhu-thi-giong-hat-vua-can-giam-khao-vua-can-khan-gia-143-1305581.htm,"Theo Thứ trưởng Trần Quốc Phương, ngoài việc đáp ứng đầy đủ 9 tiêu chí kỹ thuật, thị trường chứng khoán Việt Nam còn cần sự ủng hộ mạnh mẽ từ nhà đầu tư quốc tế để chính thức được nâng hạng trong kỳ đánh giá tháng 9/2025.","Tue, 06 May 2025 20:17:00 +0700",Chính sách,Chứng khoán,2025-07-20 11:41:44
Warren Buffett học được gì từ những thương vụ thành công và thất bại lớn nhất của mình,http://vietstock.vn/2025/05/warren-buffett-hoc-duoc-gi-tu-nhung-thuong-vu-thanh-cong-va-that-bai-lon-nhat-cua-minh-3355-1305017.htm,"Từ Coca-Cola đến Berkshire Hathaway, đâu là những khoản đầu tư thành công và đâu là những lần “vấp ngã” của vị Chủ tịch huyền thoại Berkshire Hathaway.","Tue, 06 May 2025 20:02:00 +0700",Câu chuyện đầu tư,Chứng khoán,2025-07-20 11:41:43
Tại sao sẽ không bao giờ có một Warren Buffett thứ hai?,http://vietstock.vn/2025/05/tai-sao-se-khong-bao-gio-co-mot-warren-buffett-thu-hai-3355-1305055.htm,"Chỉ có một Warren Buffett duy nhất, và sẽ không bao giờ có người thứ hai.","Tue, 06 May 2025 11:29:43 +0700",Câu chuyện đầu tư,Chứng khoán,2025-07-20 11:41:43
DCM - Kỳ vọng tăng trưởng ổn định (Kỳ 2),http://vietstock.vn/2025/05/dcm-ky-vong-tang-truong-on-dinh-ky-2-582-1302339.htm,"CTCP Phân bón Dầu khí Cà Mau (HOSE: DCM) là doanh nghiệp có cấu trúc tài chính lành mạnh và duy trì chính sách trả cổ tức tiền mặt đều đặn. Chính vì thế, DCM là cổ phiếu đáng chú ý dành cho các nhà đầu tư dài hạn.","Tue, 06 May 2025 10:02:00 +0700",Phân tích cơ bản,Phân tích,2025-07-20 11:42:32
Campuchia lý giải về sự tăng vọt tỷ lệ lạm phát trong tháng 1/2025,http://vietstock.vn/2025/03/campuchia-ly-giai-ve-su-tang-vot-ty-le-lam-phat-trong-thang-12025-1326-1276934.htm,"Theo công bố của Chính phủ Hoàng gia Campuchia, dựa trên dữ liệu được Viện Thống kê Quốc gia và Ngân hàng Trung ương Campuchia (NBC) cùng chuẩn bị, tỷ lệ lạm phát tại quốc gia này trong tháng 1/2025 đã tăng vọt lên mức 6%, làm dấy lên mối lo ngại trong công chúng.","Tue, 04 Mar 2025 21:02:00 +0700",Vĩ mô,Đông Dương,2025-07-20 11:42:16
HPG - Trong nguy có cơ (Kỳ 1),http://vietstock.vn/2025/03/hpg-trong-nguy-co-co-ky-1-582-1274249.htm,"CTCP Tập đoàn Hòa Phát (HOSE: HPG) là doanh nghiệp dẫn đầu về thị phần trong nước về ngành thép, chiếm ưu thế nhờ vào năng lực sản xuất vượt trội, hệ thống phân phối rộng khắp và chất lượng sản phẩm được công nhận. Mặc dù Mỹ chính thức áp mức thuế 25% đối với nhập khẩu thép từ tất cả các quốc gia, HPG vẫn có thể duy trì lợi thế cạnh tranh và không chịu tác động đáng kể.","Tue, 04 Mar 2025 10:02:00 +0700",Phân tích cơ bản,Phân tích,2025-07-20 11:42:32
Mỹ vẫn là thị trường xuất khẩu hàng đầu của Campuchia,http://vietstock.vn/2024/12/my-van-la-thi-truong-xuat-khau-hang-dau-cua-campuchia-1326-1249810.htm,"Theo dữ liệu do Tổng cục Hải quan và Thuế (GDCE) công bố gần đây, Mỹ vẫn là thị trường xuất khẩu số một của Campuchia trong 10 tháng đầu năm 2024, Khmer Times đưa tin.","Tue, 03 Dec 2024 20:02:00 +0700",Vĩ mô,Đông Dương,2025-07-20 11:42:16
Campuchia dự định thành lập sàn giao dịch chứng chỉ quỹ bất động sản,http://vietstock.vn/2022/11/campuchia-du-dinh-thanh-lap-san-giao-dich-chung-chi-quy-bat-dong-san-1328-1014300.htm,"Cơ quan Quản lý Giao dịch chứng khoán Campuchia (SERC) dự định thành lập sàn chứng khoán chứng chỉ quỹ bất động sản để các công ty huy động tiền mặt từ công chúng, Khmer Times đưa tin.","Tue, 01 Nov 2022 20:00:00 +0700",Thị trường chứng khoán,Chứng khoán,2025-07-20 11:42:19
Lời khuyên của nữ tỷ phú 30 tuổi dành cho những ai khát khao cân bằng công việc và cuộc sống,http://vietstock.vn/2025/07/loi-khuyen-cua-nu-ty-phu-30-tuoi-danh-cho-nhung-ai-khat-khao-can-bang-cong-viec-va-cuoc-song-4262-1323286.htm,"Nữ tỷ phú 30 tuổi đồng sáng lập Scale AI, Lucy Guo, đưa ra một thông điệp dành cho những ai luôn khao khát sự cân bằng giữa công việc và cuộc sống: Có thể bạn đang làm công việc không phù hợp.","Tue, 01 Jul 2025 20:02:00 +0700",Doanh nhân và khởi nghiệp,Tài chính,2025-07-20 11:42:24
Thị trường chứng quyền 02/07/2025: Thị trường diễn biến phân hóa,http://vietstock.vn/2025/07/thi-truong-chung-quyen-02072025-thi-truong-dien-bien-phan-hoa-1636-1323558.htm,"Kết thúc phiên giao dịch ngày 01/07/2025, toàn thị trường có 69 mã tăng, 105 mã giảm và 26 mã tham chiếu. Khối ngoại quay lại mua ròng với tổng mức mua ròng đạt 847,700 CW.","Tue, 01 Jul 2025 20:00:00 +0700",Chứng quyền,Chứng khoán,2025-07-20 11:41:40
Chứng khoán phái sinh ngày 02/07/2025: Rủi ro ngắn hạn xuất hiện,http://vietstock.vn/2025/07/chung-khoan-phai-sinh-ngay-02072025-rui-ro-ngan-han-xuat-hien-1636-1323532.htm,Các hợp đồng tương lai đồng loạt giảm điểm trong phiên giao dịch ngày 01/07/2025. VN30-Index giảm điểm nhẹ đồng thời hình thành mẫu hình nến Doji kèm theo khối lượng giao dịch nằm dưới mức trung bình 20 phiên cho thấy tâm lý thận trọng của nhà đầu tư vẫn hiện hữu.,"Tue, 01 Jul 2025 19:30:00 +0700",Chứng khoán phái sinh,Chứng khoán,2025-07-20 11:41:39
Tác động từ việc siết hoạt động cho thuê căn hộ ngắn ngày,http://vietstock.vn/2025/07/tac-dong-tu-viec-siet-hoat-dong-cho-thue-can-ho-ngan-ngay-4220-1323600.htm,"Theo VARS, việc siết chặt quy định không cho phép cho thuê lưu trú ngắn hạn tại các căn hộ chung cư để ở tạo điều kiện cho các mô hình lưu trú chuyên nghiệp, hợp pháp như khách sạn, căn hộ dịch vụ phát triển, đồng thời mở ra cơ hội cho người mua ở thực khi một bộ phận chủ sở hữu căn hộ cho thuê airbnb “bán tháo”.","Tue, 01 Jul 2025 17:24:32 +0700",Đầu tư – Kinh doanh nhỏ,Tài chính,2025-07-20 11:42:23
Bất động sản Ngọc Minh không thể trả 10 tỷ đồng lãi trái phiếu trước thềm đáo hạn,http://vietstock.vn/2025/07/bat-dong-san-ngoc-minh-khong-the-tra-10-ty-dong-lai-trai-phieu-truoc-them-dao-han-3118-1323408.htm,"Trong văn bản gửi Sở Giao dịch Chứng khoán Hà Nội, Công ty TNHH Đầu tư và Bất động sản Ngọc Minh cho biết đã không thể trả khoản tiền lãi gần 10 tỷ đồng của lô trái phiếu NGOCMINH2019 vào ngày 28/03/2025.","Tue, 01 Jul 2025 16:57:18 +0700",Trái phiếu doanh nghiệp,Doanh nghiệp,2025-07-20 11:41:53
Hoàng Quân Mê Kông chậm thanh toán nợ trái phiếu,http://vietstock.vn/2025/07/hoang-quan-me-kong-cham-thanh-toan-no-trai-phieu-3118-1323485.htm,CTCP Tư vấn Thương mại Dịch vụ Địa Ốc Hoàng Quân Mê Kông (HQM) thông báo về việc chậm thanh toán lãi của lô trái phiếu HQMCH2328001 với số tiền gần 31 tỷ đồng.,"Tue, 01 Jul 2025 15:49:22 +0700",Trái phiếu doanh nghiệp,Doanh nghiệp,2025-07-20 11:41:53
Hoàng Quân Mê Kông chậm thanh toán nợ trái phiếu,http://vietstock.vn/2025/07/hoang-quan-me-kong-cham-thanh-toan-no-trai-phieu-3118-1323485.htm,CTCP Tư vấn Thương mại Dịch vụ Địa Ốc Hoàng Quân Mê Kông (HQM) thông báo về việc chậm thanh toán lãi của lô trái phiếu HQMCH2328001 với số tiền gần 31 tỷ đồng.,"Tue, 01 Jul 2025 15:49:22 +0700",Trái phiếu,Chứng khoán,2025-07-20 11:41:45
Chủ nhà máy sản xuất PP và kho chứa LPG tỷ đô huy động 250 tỷ đồng trái phiếu,http://vietstock.vn/2025/07/chu-nha-may-san-xuat-pp-va-kho-chua-lpg-ty-do-huy-dong-250-ty-dong-trai-phieu-3118-1323486.htm,"Công ty TNHH Hóa chất Hyosung Vina (Hyosung Vina Chemicals) vốn điều lệ hơn 19.2 ngàn tỷ đồng, mới đây hoàn tất huy động 250 tỷ đồng trái phiếu với lãi suất 7%/năm. Hyosung Vina Chemicals là chủ đầu tư dự án nhà máy sản xuất PP và kho ngầm chứa khí hóa lỏng LPG 1.3 tỷ USD tại tỉnh Bà Rịa - Vũng Tàu.","Tue, 01 Jul 2025 15:31:41 +0700",Trái phiếu doanh nghiệp,Doanh nghiệp,2025-07-20 11:41:53
Chủ nhà máy sản xuất PP và kho chứa LPG tỷ đô huy động 250 tỷ đồng trái phiếu,http://vietstock.vn/2025/07/chu-nha-may-san-xuat-pp-va-kho-chua-lpg-ty-do-huy-dong-250-ty-dong-trai-phieu-3118-1323486.htm,"Công ty TNHH Hóa chất Hyosung Vina (Hyosung Vina Chemicals) vốn điều lệ hơn 19.2 ngàn tỷ đồng, mới đây hoàn tất huy động 250 tỷ đồng trái phiếu với lãi suất 7%/năm. Hyosung Vina Chemicals là chủ đầu tư dự án nhà máy sản xuất PP và kho ngầm chứa khí hóa lỏng LPG 1.3 tỷ USD tại tỉnh Bà Rịa - Vũng Tàu.","Tue, 01 Jul 2025 15:31:41 +0700",Trái phiếu,Chứng khoán,2025-07-20 11:41:45
Giá gas bán lẻ trong nước tháng Bảy tiếp tục giảm,http://vietstock.vn/2025/06/gia-gas-ban-le-trong-nuoc-thang-bay-tiep-tuc-giam-34-1323349.htm,"Giá gas bình Petrolimex bán lẻ tháng 7/2025 tại thị trường Hà Nội là 434.200 đồng/bình dân dụng 12kg; 1.736.700 đồng/bình công nghiệp 48kg, lần lượt giảm 18.600 đồng/bình 12kg; 74.400 đồng/bình 48kg.","Tue, 01 Jul 2025 09:55:40 +0700",Nhiên liệu,Hàng hóa,2025-07-20 11:42:01
"Campuchia, Mỹ đạt tiến triển trong đàm phán, chuẩn bị cho vòng tiếp theo",http://vietstock.vn/2025/06/campuchia-my-dat-tien-trien-trong-dam-phan-chuan-bi-cho-vong-tiep-theo-1326-1323285.htm,"Cả Campuchia và Mỹ đều bày tỏ cam kết hợp tác chặt chẽ để đạt được quyết định chung, mang lại lợi ích cho cả hai bên.","Tue, 01 Jul 2025 00:01:31 +0700",Vĩ mô,Đông Dương,2025-07-20 11:42:16
Những cỗ máy kiếm tiền của gia đình Trump (kỳ 2): Các thương vụ tiền mã hóa,http://vietstock.vn/2025/05/nhung-co-may-kiem-tien-cua-gia-dinh-trump-ky-2-cac-thuong-vu-tien-ma-hoa-4309-1311963.htm,"Chỉ mới 4 năm trước, Trump còn gọi Bitcoin là lừa đảo. Giờ đây, ông lại trở thành người cổ vũ mạnh mẽ cho tiền mã hóa, quảng bá hàng loạt sản phẩm số mang tên mình, trong khi các lãnh đạo và doanh nghiệp tiền số từng đóng góp hàng triệu USD cho chiến dịch trở lại Nhà Trắng của Trump đang kỳ vọng sẽ tác động đến chính sách.","Thu, 29 May 2025 11:02:00 +0700",Tiền kỹ thuật số,Thế giới,2025-07-20 11:42:12
Đà tăng giá mạnh của bitcoin thúc đẩy nhiều công ty nhập cuộc,http://vietstock.vn/2025/05/da-tang-gia-manh-cua-bitcoin-thuc-day-nhieu-cong-ty-nhap-cuoc-4309-1313082.htm,"Số công ty đại chúng nắm giữ bitcoin trên thế giới tăng từ 89 vào đầu tháng Tư lên 113 tính đến cuối tháng 5, trong đó công ty nắm giữ nhiều nhất lên đến 580.000 bitcoin.","Thu, 29 May 2025 09:14:27 +0700",Tiền kỹ thuật số,Thế giới,2025-07-20 11:42:12
"Chứng khoán Campuchia giảm nhẹ trong quý 3, sắp có ba doanh nghiệp mới niêm yết",http://vietstock.vn/2023/09/chung-khoan-campuchia-giam-nhe-trong-quy-3-sap-co-ba-doanh-nghiep-moi-niem-yet-1328-1110262.htm,"Giá cổ phiếu của đa số các doanh nghiệp niêm yết (DNNY) trên Sở Giao dịch Chứng khoán Campuchia (CSX) đều giảm do lực bán mạnh hơn mua. Trong khi đó, thị trường chứng khoán Campuchia cũng đang kỳ vọng sẽ có thêm 3 DNNY mới vào cuối năm nay, một quan chức cấp cao của CSX cho biết, Khmer Times đưa tin.","Thu, 28 Sep 2023 20:00:00 +0700",Thị trường chứng khoán,Chứng khoán,2025-07-20 11:42:19
PVFCCo - Phú Mỹ và Vùng 4 Hải quân ký kết quy chế hoạt động giai đoạn 2025-2030,http://vietstock.vn/2025/03/pvfcco-phu-my-va-vung-4-hai-quan-ky-ket-quy-che-hoat-dong-giai-doan-2025-2030-735-1286475.htm,"Vừa qua, Tổng công ty Phân bón và Hóa chất Dầu khí - CTCP (PVFCCo, Phú Mỹ) và Bộ Tư lệnh Vùng 4 Hải quân đã ký kết quy chế hoạt động giai đoạn 2025-2030.","Thu, 27 Mar 2025 14:50:24 +0700",Vì cộng đồng,Tài chính,2025-07-20 11:42:29
Vàng thế giới lùi nhẹ khi đồng USD và lợi suất trái phiếu Mỹ tăng,http://vietstock.vn/2025/03/vang-the-gioi-lui-nhe-khi-dong-usd-va-loi-suat-trai-phieu-my-tang-759-1286272.htm,"Giá vàng giảm vào ngày thứ Tư (26/03), khi đồng USD và lợi suất trái phiếu Mỹ tăng, mặc dù lo ngại về chính sách thuế quan mới của Tổng thống Mỹ Donald Trump đã giữ giá vàng ở trên ngưỡng 3,000 USD/oz.","Thu, 27 Mar 2025 07:40:35 +0700",Tài chính - Ngân hàng,Tài chính,2025-07-20 11:42:18
Nhiều vi phạm trong cổ phần hoá Tổng công ty Tín Nghĩa ở Đồng Nai,http://vietstock.vn/2024/09/nhieu-vi-pham-trong-co-phan-hoa-tong-cong-ty-tin-nghia-o-dong-nai-746-1231739.htm,Thanh tra Chính phủ (TTCP) vừa ban hành thông báo kết luận thanh tra việc chấp hành pháp luật trong cổ phần hóa (CPH) và thoái vốn nhà nước tại Tổng công ty Tín Nghĩa (nay là Công ty CP Tổng công ty Tín Nghĩa).,"Thu, 26 Sep 2024 14:35:00 +0700",IPO - Cổ phần hóa,Doanh nghiệp,2025-07-20 11:41:50
Thị trường chứng quyền 27/06/2025: Những tín hiệu trái chiều đang xuất hiện,http://vietstock.vn/2025/06/thi-truong-chung-quyen-27062025-nhung-tin-hieu-trai-chieu-dang-xuat-hien-1636-1322008.htm,"Kết thúc phiên giao dịch ngày 26/06/2025, toàn thị trường có 67 mã tăng, 106 mã giảm và 54 mã tham chiếu. Khối ngoại quay lại mua ròng với tổng mức mua ròng đạt 1.56 triệu CW.","Thu, 26 Jun 2025 20:00:00 +0700",Chứng quyền,Chứng khoán,2025-07-20 11:41:40
Chứng khoán phái sinh ngày 27/06/2025: Tâm lý thận trọng chi phối thị trường,http://vietstock.vn/2025/06/chung-khoan-phai-sinh-ngay-27062025-tam-ly-than-trong-chi-phoi-thi-truong-1636-1321973.htm,Các hợp đồng tương lai tăng giảm trái chiều trong phiên giao dịch ngày 26/06/2025. VN30-Index giảm điểm đồng thời xuất hiện mẫu hình nến gần giống Doji cùng khối lượng giao dịch sụt giảm và nằm dưới mức trung bình 20 phiên cho thấy tâm lý thận trọng của nhà đầu tư.,"Thu, 26 Jun 2025 19:30:00 +0700",Chứng khoán phái sinh,Chứng khoán,2025-07-20 11:41:39
"Gia Khang sẽ bán dự án Giga City ở Thủ Đức để trả 2,500 tỷ đồng nợ trái phiếu",http://vietstock.vn/2025/06/gia-khang-se-ban-du-an-giga-city-o-thu-duc-de-tra-2500-ty-dong-no-trai-phieu-3118-1321986.htm,"Theo nghị quyết ngày 23/06, trái chủ của CTCP Đầu tư Thương mại Dịch vụ Gia Khang (Gia Khang, GKCC) thông qua việc giải chấp toàn bộ tài sản bảo đảm của trái phiếu và giao dịch bán/chuyển nhượng toàn bộ cổ phần An Khang Land với giá được đề xuất 2,000 tỷ đồng.","Thu, 26 Jun 2025 17:03:39 +0700",Trái phiếu doanh nghiệp,Doanh nghiệp,2025-07-20 11:41:53
